{
  "candidate_id": "cand_018f3e40-7b80-7a21-8000-000000000002",
  "candidate_record_digest": "sha256:a6bfe799f607363cfd5c58318456c3b1e02fa8c4635d91e80526295e8c828268",
  "classification": "private_operational",
  "entries": [
    {
      "digest": "sha256:4444444444444444444444444444444444444444444444444444444444444444",
      "entry_type": "file",
      "executable": false,
      "path": "skills/context-fundamentals/SKILL.md",
      "size_bytes": 256
    }
  ],
  "expected_draft_digest": "sha256:b8e307cfcac5d7455c0e352c7b13e65aa997c023280b5fd90ac37454c00f3441",
  "file_count": 1,
  "freeze_policy_digest": "sha256:9157324eaf7ec5a74b6817c7183fbc79cfd2f0292629ae426c3cdf179378aeb8",
  "frozen_at": "2026-08-10T12:01:00Z",
  "id": "freeze_018f3e40-7b80-7a21-8000-000000000005",
  "kind": "FreezeReceipt",
  "root_production_epoch": "main@a1841d1",
  "schema_version": "1.0.0",
  "schema_registry_digest": "sha256:4dd1f2e66bd6302eecb4b1cb876b5e288f4a6a82b036c87f3bde8889a56b228f",
  "total_size_bytes": 256,
  "tree_digest": "sha256:b8e307cfcac5d7455c0e352c7b13e65aa997c023280b5fd90ac37454c00f3441"
}
